用户名,UID,评论视频标题,评论视频 BV,评论内容,评论时间,IP 属地
"小新蛋",53439250,"袁绍粉丝在曹操墓里背诵《讨贼檄文》，轰动全网！！","BV1hL411i7bW","这人整天故弄玄虚 哗众取宠 另一种网络小丑 怎么一个个还觉得他有风骨 看不懂","2023-06-10","广东"
"西西河主",66940016,"迫击炮到了他的手里，变成了艺术","BV1V8411m7ED","胡扯。以前的宣传都是针对文盲的。今天再这样。是把人当傻瓜吗","2023-07-22 22:10","山东"
"堂吉诃德Doflamingo",107355549,"堵车时，第一辆车在干什么？","BV14y4y1R7Aj","只会报警，看到UP这种人平时躲得远远的，搞得自己跟正义侠救世主一样。","2023-01-21","新疆"
"新月75",360152623,"失业问题到底有多严重？","BV1Su411a7A3","多虑了，我家保姆月薪1万都难找，来的都是50岁老奶奶。失业率在哪？没有所谓失业率，只有懒蛋 ​","2023-07-29","北京"
"风吹大腿长",1074687706,"68岁老人4次下水救女孩，家人用莆田最高礼仪上门答谢：双向奔赴","BV1Ze4y1f73n","​莆田刑案欧金中，昔日救人英雄，今日杀人凶手，是什么毁灭了55岁的农民大叔[BV1gL4y1B77f]​","2022-08-23","福建"
