用户名,UID,评论视频标题,评论视频 BV,评论内容,评论时间,IP 属地
"2丶也是一种境界",165436406,"的哥绕道35公里多赚80块，致外地乘客误了飞机：第2天机票涨价了","BV1cQ4y1H7vD","你身边全是好人，别人身边全是坏人","2023-10-26","浙江"
"舒雪莹",332337965,"网友：生产芯片的事先不要着急，先把米尺做好了再指引方向","BV1Y94y1w7tK","这玩意在工地上正常得很。不要见怪不怪的","2023-12-26 21","广东"
"DD第二代",390244162,"日本东京羽田机场两飞机相撞 5人死亡","BV11e411v7Tx","如何定义爱国","2024-01-02 22","上海"
"lv6复活",516494532,"玩小美评审团至今，最逆天的差评出现了","BV1pe411k7US","看懂了，顾客把不是商品的选项点了46份。这个锅商家得背一半吧[吃瓜]","2023-12-16 09:50","广西"
"bili_51684477231",1892454564,"我给外卖下泻药，把小偷拉脱肛了，违法吗？","BV1wH4y1q7GL","属于，而且是故意的，只是对方症状比较轻应该事情不是很大赔点钱可能就没事了，UP猪完全不懂法，只是按照心里喜欢的来，现实会很打脸，除非那个下泻药的家庭背景强大才可能一点事都没有，毕竟法律不外乎人情","2023-11-17 16","安徽"
"fjeizbfurbcuwhei",3493295806221190,"迪士尼这么6吗，这评论区直接把我字体都改了","885058103915053072","那么你知道今天是长津湖战役胜利多少年零多少天吗？","2024-01-13","广东"
"时光荏苒_______",3494357734787464,"重男轻女的地方活该落后！","BV1Cv4y1s7Fx","我就是福建的，从没有被老公家暴过，也没听说过我们这里有什么重男轻女啊。","2023-10-21 22:31:36","河南"
